title,url
Accepting Apple Pay with WooCommerce Payments,https://woocommerce.com/document/woocommerce-payments/payment-methods/apple-pay/
What is the difference between a scheduled deposit and instant deposit?,https://woocommerce.com/document/woocommerce-payments/deposits/scheduled-deposit-vs-instant-deposit/
WooCommerce In-Person Payments Quick Start Guide - Canada Merchants,https://woocommerce.com/document/woocommerce-in-person-payments-quick-start-guide-canada-merchants/
WooCommerce Payments: Customization & Translation,https://woocommerce.com/document/woocommerce-payments/customization-and-translation/
WooCommerce Payments: Testing & Troubleshooting,https://woocommerce.com/document/woocommerce-payments/testing-and-troubleshooting/
WooCommerce Payments + Stripe Capital,https://woocommerce.com/document/woocommerce-payments-stripe-capital/
Instant Deposits with WooCommerce Payments,https://woocommerce.com/document/payments/instant-deposits/
WooCommerce Payments: Link by Stripe,https://woocommerce.com/document/woocommerce-payments/payment-methods/link-by-stripe/
WooCommerce Payments: Subscriptions,https://woocommerce.com/document/woocommerce-payments/built-in-subscriptions/
Connecting to WordPress.com with WooCommerce Payments,https://woocommerce.com/document/payments/connection/
Translations (Localization),https://woocommerce.com/document/woocommerce-payments/customization-and-translation/translations/
Can I change the title and description of the payment gateway shown during checkout?,https://woocommerce.com/document/woocommerce-payments/customization-and-translation/change-title-in-checkout/
Comparing subscription options,https://woocommerce.com/document/payments/subscriptions-basics/comparison/
"WooCommerce Payments: ""Know Your Customer""",https://woocommerce.com/document/woocommerce-payments/our-policies/woocommerce-payments-know-your-customer/
How do I change my business type?,https://woocommerce.com/document/woocommerce-payments/account-management/change-business-type/
Can I sell CBD and Other Hemp-Derived Products with WooCommerce Payments?,https://woocommerce.com/document/woocommerce-payments/our-policies/cbd/
Moving from WooCommerce Subscriptions to the WooCommerce Payments subscriptions functionality,https://woocommerce.com/document/payments/subscriptions-basics/moving-from-the-woocommerce-subscriptions-extension/
Does WooCommerce Payments support Pre-Orders?,https://woocommerce.com/document/woocommerce-payments/compatibility/pre-orders/
What happens to my subscriptions if I disable the WooCommerce Payments gateway?,https://woocommerce.com/document/woocommerce-payments/built-in-subscriptions/disable-gateway/
Does WooCommerce Payments support Subscriptions and recurring payments?,https://woocommerce.com/document/woocommerce-payments/built-in-subscriptions/subscriptions/
What are the fees for WooCommerce Payments?,https://woocommerce.com/document/woocommerce-payments/fees-and-debits/fees/
Upgrading to the Subscriptions extension from the WooCommerce Payments built-in subscriptions,https://woocommerce.com/document/payments/subscriptions-basics/upgrading-to-subscriptions/
Does WooCommerce Payments have any fraud prevention enabled?,https://woocommerce.com/document/woocommerce-payments/fraud-and-disputes/fraud-prevention/
Preventing Disputes with WooCommerce Payments,https://woocommerce.com/document/payments/preventing-disputes-with-woocommerce-payments/
How do I sign up for Stripe using the same email as my WooCommerce Payments account?,https://woocommerce.com/document/woocommerce-payments/account-management/sign-up-for-stripe-same-email/
Additional payment methods,https://woocommerce.com/document/payments/additional-payment-methods/
WooCommerce Payments: Fees & Debits,https://woocommerce.com/document/woocommerce-payments/fees-and-debits/
Deposit currencies,https://woocommerce.com/document/payments/currencies/multiple-deposit-currencies/
WooCommerce Payments built in partnership with Stripe,https://woocommerce.com/document/payments/built-in-partnership-with-stripe/
Do I need WooCommerce Payments for all other payment gateways?,https://woocommerce.com/document/woocommerce-payments/compatibility/need-woocommerce-payments-for-other-gateways/
How do I respond to card testing attacks?,https://woocommerce.com/document/woocommerce-payments/fraud-and-disputes/card-testing/
Why is there a charge from WooPay.id on my credit card?,https://woocommerce.com/document/woopay-statement-descriptor/
Why aren’t fees refunded when I refund a charge with WooCommerce Payments?,https://woocommerce.com/document/woocommerce-payments/fees-and-debits/why-arent-fees-refunded/
Requirements and recommendations for bank statement descriptor,https://woocommerce.com/document/payments/bank-statement-descriptor/
Stripe Capital FAQ,https://woocommerce.com/document/stripe-capital-faq/
Multi-Currency with WooCommerce Payments,https://woocommerce.com/document/woocommerce-payments/currencies/multi-currency-setup/
WooCommerce Payments: Taxes,https://woocommerce.com/document/woocommerce-payments/taxes/
Can I migrate my information between accounts?,https://woocommerce.com/document/woocommerce-payments/account-management/migrate-information-between-accounts/
WooCommerce In-Person Payments Quick Start Guide,https://woocommerce.com/document/payments/woocommerce-in-person-payments-quick-start-guide/
Testing WooCommerce Payments,https://woocommerce.com/document/woocommerce-payments/testing-and-troubleshooting/testing/
WooCommerce Payments in Your Country,https://woocommerce.com/document/woocommerce-payments/compatibility/countries/
WooCommerce Payments: Currencies,https://woocommerce.com/document/woocommerce-payments/currencies/
Deactivating WooCommerce Subscriptions with WooCommerce Payments active,https://woocommerce.com/document/subscriptions/deactivation/
WooCommerce Payments Safe Mode,https://woocommerce.com/document/woocommerce-payments/testing-and-troubleshooting/safe-mode/
What happens to my subscriptions if I deactivate the WooCommerce Payments plugin?,https://woocommerce.com/document/woocommerce-payments/built-in-subscriptions/deactivate/
How do I change my deposit schedule?,https://woocommerce.com/document/woocommerce-payments/deposits/change-deposit-schedule/
Can I use WooCommerce Payments and the Stripe plugin at the same time?,https://woocommerce.com/document/can-i-use-woocommerce-payments-and-the-stripe-plugin-at-the-same-time/
Why does Stripe say that my account is linked to a business that works with Stripe?,https://woocommerce.com/document/woocommerce-payments/account-management/stripe-account-linked-to-business/
WooCommerce Payments: In-Person Payments,https://woocommerce.com/document/woocommerce-payments/in-person-payments/
WooCommerce Payments: Payment Methods,https://woocommerce.com/document/woocommerce-payments/payment-methods/
Subscriptions with WooCommerce Payments,https://woocommerce.com/document/payments/subscriptions-basics/
Im a developer or agency. How can I set up WooCommerce Payments for my client?,https://woocommerce.com/document/woocommerce-payments/account-management/developer-or-agency-setup/
Is WooCommerce Payments compatible with High-Performance Order Storage?,https://woocommerce.com/document/woocommerce-payments/compatibility/high-performance-order-storage-compatibility/
Why is my account showing a negative balance?,https://woocommerce.com/document/woocommerce-payments/fees-and-debits/account-showing-negative-balance/
WooCommerce Payments: Startup Guide,https://woocommerce.com/document/payments/
WooCommerce Payments: Stripe Capital,https://woocommerce.com/document/woocommerce-payments/stripe-capital/
What foreign exchange fees are charged with WooCommerce Payments?,https://woocommerce.com/document/woocommerce-payments/fees-and-debits/currency-conversion-fees/
Managing Disputes with WooCommerce Payments,https://woocommerce.com/document/woocommerce-payments/fraud-and-disputes/managing-disputes-with-woocommerce-payments/
Switching from Stripe to WooCommerce Payments,https://woocommerce.com/document/woocommerce-payments/account-management/switching-from-stripe-to-woocommerce-payments/
What’s the difference between a Payout and a Deposit in WooCommerce Payments?,https://woocommerce.com/document/woocommerce-payments/deposits/deposits-and-payouts/
Can I sell alcohol with WooCommerce Payments?,https://woocommerce.com/document/woocommerce-payments/our-policies/can-i-sell-alcohol-with-woocommerce-payments/
How do I update my business name or DBA with WooCommerce Payments?,https://woocommerce.com/document/woocommerce-payments/account-management/name-changes/
WooCommerce Payments: Reserves,https://woocommerce.com/document/payments/reserves/
WooCommerce Payments: Compatibility,https://woocommerce.com/document/woocommerce-payments/compatibility/
How do I update my tax ID number with WooCommerce Payments?,https://woocommerce.com/document/woocommerce-payments/account-management/tax-id-changes/
WooCommerce Payments: Dev Mode,https://woocommerce.com/document/woocommerce-payments/testing-and-troubleshooting/testing/dev-mode/
WooCommerce Payments: Our Policies,https://woocommerce.com/document/woocommerce-payments/our-policies/
Does WooCommerce Payments support 3D Secure?,https://woocommerce.com/document/woocommerce-payments/fraud-and-disputes/3d-secure/
WooCommerce Payments vs. Stripe Plugin Comparison,https://woocommerce.com/document/woocommerce-payments-vs-stripe-plugin-comparison/
Is WooCommerce Payments PCI Compliant?,https://woocommerce.com/document/woocommerce-payments/our-policies/pci-compliance/
WooCommerce Payments Settings Guide,https://woocommerce.com/document/woocommerce-payments/settings-guide/
Why are deposits to my bank account suspended?,https://woocommerce.com/document/woocommerce-payments/deposits/why-deposits-suspended/
WooCommerce Payments: Deposits,https://woocommerce.com/document/woocommerce-payments/deposits/
Troubleshooting WooCommerce Payments,https://woocommerce.com/document/payments/troubleshooting/
How do I update my contact details such as email address or phone number in Stripe?,https://woocommerce.com/document/woocommerce-payments/account-management/update-my-contact-details/
What products are not permitted on my store when accepting payments with WooCommerce Payments?,https://woocommerce.com/document/woocommerce-payments/our-policies/restricted-products/
WooCommerce Payments FAQs,https://woocommerce.com/document/payments/faq/
Why is there a debit from WCPAYMENTS or WooCommerce Payments on my bank account?,https://woocommerce.com/document/woocommerce-payments/fees-and-debits/why-was-i-debited/
Can one WooCommerce Payments account be used with multiple websites?,https://woocommerce.com/document/woocommerce-payments/account-management/one-woocommerce-payments-account-multiple-websites/
How do I change my deposit account information with WooCommerce Payments?,https://woocommerce.com/document/woocommerce-payments/deposits/change-deposit-account-info/
Can I use my existing Stripe account with WooCommerce Payments?,https://woocommerce.com/document/woocommerce-payments/account-management/existing-stripe-account/
WooCommerce Payments Card Reader Return Policy,https://woocommerce.com/document/woocommerce-payments/in-person-payments/woocommerce-payments-card-reader-return-policy/
WooCommerce Payments Documentation,https://woocommerce.com/document/woocommerce-payments/
What currency is used to determine fees in a transaction with WooCommerce Payments?,https://woocommerce.com/document/woocommerce-payments/fees-and-debits/fee-currency/
WooCommerce Payments: Account Management,https://woocommerce.com/document/woocommerce-payments/account-management/
WooCommerce Payments — Documents,https://woocommerce.com/document/woocommerce-payments/taxes/woocommerce-payments-documents/
What is Form 1099-K?,https://woocommerce.com/document/woocommerce-payments/taxes/what-is-form-1099k/
"What is the ""Things to do"" checklist?",https://woocommerce.com/document/woocommerce-payments/account-management/things-to-do-checklist/
Why is there a Subscriptions item in my WooCommerce menu?,https://woocommerce.com/document/woocommerce-payments/built-in-subscriptions/subscriptions-item-in-menu/
How do I access my Stripe Express account for WooCommerce Payments?,https://woocommerce.com/document/woocommerce-payments/account-management/access-stripe-account/
When will I receive deposits for my WooCommerce Payments account balance?,https://woocommerce.com/document/woocommerce-payments/deposits/deposit-schedule/
Currencies with WooCommerce Payments,https://woocommerce.com/document/payments/currencies/
WooCommerce Payments: Fraud and Disputes,https://woocommerce.com/document/woocommerce-payments/fraud-and-disputes/
Getting started with In-Person Payments with WooCommerce Payments,https://woocommerce.com/document/payments/getting-started-with-in-person-payments-with-woocommerce-payments/
Managing Money with WooCommerce Payments,https://woocommerce.com/document/woocommerce-payments/managing-money/
How do I delete or stop using my WooCommerce Payments account?,https://woocommerce.com/document/woocommerce-payments/account-management/delete-my-woocommerce-payments-account/
What currencies can I accept with WooCommerce Payments?,https://woocommerce.com/document/woocommerce-payments/currencies/available-currencies/
Which add-ons are compatible with subscriptions built-in to WooCommerce Payments?,https://woocommerce.com/document/woocommerce-payments/compatibility/compatible-subscriptions-extensions/
Does WooCommerce Payments use Stripe Radar?,https://woocommerce.com/document/woocommerce-payments/fraud-and-disputes/does-woocommerce-payments-use-stripe-radar/
Authorize and capture,https://woocommerce.com/document/woocommerce-payments/settings-guide/authorize-and-capture/
How do I transfer a site that uses WooCommerce Payments to a new owner?,https://woocommerce.com/document/woocommerce-payments/account-management/transfer-site-to-new-owner/
Accepting Google Pay with WooCommerce Payments,https://woocommerce.com/document/woocommerce-payments/payment-methods/google-pay/
Croatian Kuna (HRK) transition to Euro (EUR),https://woocommerce.com/document/woocommerce-payments/currencies/croatian-kuna-to-euro-transition/
WooCommerce In-Person Payments: Tap to Pay on iPhone Quick Start Guide,https://woocommerce.com/document/woocommerce-payments/in-person-payments/woocommerce-in-person-payments-tap-to-pay-on-iphone-quick-start-guide/